{
  "projection_id": "sha256:1afd8e1e5022a039d5635bacdf52ac7b60fbab46bd0d1a581518be1ce95ae797",
  "protocol": "qsol-control-dna-lattice/1",
  "codec": "qsol.dna-2bit-codon64/1",
  "alphabet": ["A", "C", "G", "T"],
  "bit_mapping": {"A": "00", "C": "01", "G": "10", "T": "11"},
  "lattice_profile": "qsol-3x3x3-sierpinski-derived-memory/1",
  "traversal_id": "qsol.phi-stride-27/1",
  "traversal_rule": "round_robin_codon_assignment_across_versioned_27_cell_path",
  "byte_length": 1,
  "base_length": 4,
  "padding_bases": 2,
  "codon_count": 2,
  "content_sha256": "77adfc95029e73b173f60e556f915b0cd8850848111358b1c370fb7c154e61fd",
  "cells": {
    "L[0,0,0]": "ACG",
    "L[0,0,1]": "",
    "L[0,0,2]": "",
    "L[0,1,0]": "",
    "L[0,1,1]": "",
    "L[0,1,2]": "",
    "L[0,2,0]": "",
    "L[0,2,1]": "",
    "L[0,2,2]": "",
    "L[1,0,0]": "",
    "L[1,0,1]": "",
    "L[1,0,2]": "",
    "L[1,1,0]": "",
    "L[1,1,1]": "",
    "L[1,1,2]": "",
    "L[1,2,0]": "",
    "L[1,2,1]": "",
    "L[1,2,2]": "TAA",
    "L[2,0,0]": "",
    "L[2,0,1]": "",
    "L[2,0,2]": "",
    "L[2,1,0]": "",
    "L[2,1,1]": "",
    "L[2,1,2]": "",
    "L[2,2,0]": "",
    "L[2,2,1]": "",
    "L[2,2,2]": ""
  },
  "codon_histogram": {"6": 1, "48": 1},
  "derived": true,
  "rebuildable": true,
  "authority": "none",
  "storage_claim": "reversible_recovery_projection_not_compression_claim"
}
